{"$schema":"https://json-schema.org/draft/2020-12/schema","type":"object","additionalProperties":false,"required":["receipt_id","selection_method","records","summary","prohibited_next_step","next_permitted_action"],"properties":{"receipt_id":{"const":"system-one-seed-pre-admission-1"},"selection_method":{"const":"design-pattern-first-seven-condition-screen"},"records":{"type":"array","minItems":5,"maxItems":8,"items":{"type":"object","additionalProperties":false,"required":["seed_id","pattern_id","primary_source","official_data","conditions","disposition","reason"],"properties":{"seed_id":{"pattern":"^seed-","type":"string"},"pattern_id":{"pattern":"^seed-pattern-","type":"string"},"primary_source":{"type":"object","additionalProperties":false,"required":["url","location"],"properties":{"url":{"type":"string","format":"uri"},"location":{"type":"string","minLength":12}}},"official_data":{"type":"object","additionalProperties":false,"required":["url","artifact","checksum"],"properties":{"url":{"type":"string","format":"uri"},"artifact":{"type":"string","minLength":3},"checksum":{"pattern":"^[a-f0-9]{32}$","type":"string"}}},"conditions":{"type":"array","minItems":7,"maxItems":7,"items":{"type":"object","additionalProperties":false,"required":["condition_id","status","evidence"],"properties":{"condition_id":{"enum":["bounded-claim","raw-content","reproducible-baseline","named-boundary","independent-structure","meaningful-consequences","self-contained-interpretation"]},"status":{"enum":["pass","fail"]},"evidence":{"type":"string","minLength":20}}}},"disposition":{"enum":["pre-admitted-seed","rejected-pre-admission"]},"reason":{"type":"string","minLength":30}}}},"summary":{"type":"object","additionalProperties":false,"required":["records_screened","pre_admitted_count","rejected_count","quality_measure_state"],"properties":{"records_screened":{"const":5},"pre_admitted_count":{"type":"integer","minimum":0,"maximum":5},"rejected_count":{"type":"integer","minimum":0,"maximum":5},"quality_measure_state":{"type":"string","minLength":40}}},"prohibited_next_step":{"type":"string","minLength":30},"next_permitted_action":{"type":"string","minLength":30}}}
