{"receipt_id":"system-one-seed-pre-admission-1","selection_method":"design-pattern-first-seven-condition-screen","records":[{"seed_id":"seed-locomotor-repeatability","pattern_id":"seed-pattern-within-between-repeated-unit","primary_source":{"url":"https://doi.org/10.1242/jeb.141259","location":"Abstract: two Ucrit trials and repeatability mixed-model result."},"official_data":{"url":"https://zenodo.org/records/5000340","artifact":"Ucrit_repeatability.csv","checksum":"34862a91ae4dd51d417b503f85b23362"},"conditions":[{"condition_id":"bounded-claim","status":"pass","evidence":"The article's abstract reports a bounded repeatability claim for Ucrit across two ages."},{"condition_id":"raw-content","status":"pass","evidence":"The official CSV downloaded as non-empty row-level trial data with animal IDs."},{"condition_id":"reproducible-baseline","status":"fail","evidence":"The accessible record supplies CSV files but no analysis code or complete model specification for reproducing the published baseline."},{"condition_id":"named-boundary","status":"fail","evidence":"No separately documented artifact, confounder, or robustness boundary was located in the preliminary source receipt."},{"condition_id":"independent-structure","status":"pass","evidence":"Repeated trials per animal provide a within-unit structure."},{"condition_id":"meaningful-consequences","status":"fail","evidence":"Without a named challenge boundary, positive, null, and contrary outcomes cannot yet be stated non-arbitrarily."},{"condition_id":"self-contained-interpretation","status":"pass","evidence":"The measured outcome and repeated-unit structure are identified in the source and file columns."}],"disposition":"rejected-pre-admission","reason":"The record has real raw content and repeated units, but lacks a reproducible baseline and a predeclared fragility boundary."},{"seed_id":"seed-replicated-time-series","pattern_id":"seed-pattern-replicated-baseline-change","primary_source":{"url":"https://doi.org/10.1038/hdy.2016.98","location":"DOI landing record; primary full-text baseline was not retrieved in this screen."},"official_data":{"url":"https://zenodo.org/records/4991393","artifact":"README_for_python_qt_simulator.txt","checksum":"5af77c430b65fa536797ae3400d984d7"},"conditions":[{"condition_id":"bounded-claim","status":"fail","evidence":"No bounded published claim was confirmed from a retrieved primary source during the preliminary screen."},{"condition_id":"raw-content","status":"fail","evidence":"The checked artifact is a simulator README, not a directly verified public raw-observation dataset."},{"condition_id":"reproducible-baseline","status":"fail","evidence":"A simulator command is described, but the published empirical baseline was not established."},{"condition_id":"named-boundary","status":"fail","evidence":"No named artifact or robustness boundary was verified from primary-source text."},{"condition_id":"independent-structure","status":"fail","evidence":"No independent partition or repeated observational structure was verified."},{"condition_id":"meaningful-consequences","status":"fail","evidence":"No challengeable claim and boundary were established."},{"condition_id":"self-contained-interpretation","status":"fail","evidence":"The relation of the simulator record to a self-contained empirical interpretation remains unverified."}],"disposition":"rejected-pre-admission","reason":"This is an implementation-like archive record, not verified evidence of an investigation-ready empirical design."},{"seed_id":"seed-growth-trajectory-missingness","pattern_id":"seed-pattern-within-between-repeated-unit","primary_source":{"url":"https://doi.org/10.1086/692797","location":"DOI landing record; full primary baseline not used beyond initial identification."},"official_data":{"url":"https://zenodo.org/records/4992283","artifact":"README_for_sheep sizes.txt","checksum":"527f3523db8e0a6d217a92fb396083af"},"conditions":[{"condition_id":"bounded-claim","status":"fail","evidence":"A bounded published claim was not confirmed in a retrieved primary source during the screen."},{"condition_id":"raw-content","status":"fail","evidence":"The checked README describes access constraints and recoded IDs rather than a self-sufficient raw-data artifact."},{"condition_id":"reproducible-baseline","status":"fail","evidence":"No reproducible published baseline or analysis code was confirmed."},{"condition_id":"named-boundary","status":"pass","evidence":"The README explicitly warns that errors may be corrected and that project data require deeper context."},{"condition_id":"independent-structure","status":"fail","evidence":"A usable independent partition was not established from the accessible receipt."},{"condition_id":"meaningful-consequences","status":"fail","evidence":"No bounded analysis plan can be stated without an identified baseline and usable linkage."},{"condition_id":"self-contained-interpretation","status":"fail","evidence":"The README directs users to contact the project and says recoded IDs cannot link to the broader project database."}],"disposition":"rejected-pre-admission","reason":"The archive itself documents an unavailable-context and linkage gap, so it is a selector negative control rather than a seed."},{"seed_id":"seed-predator-response-synthesis","pattern_id":"seed-pattern-evidence-table-reconciliation","primary_source":{"url":"https://doi.org/10.1098/rspb.2018.0857","location":"Article methods: 94 tests from 28 papers after screening 233 papers."},"official_data":{"url":"https://zenodo.org/records/5002828","artifact":"Meta Analysis Data for Dryad.xlsb","checksum":"6cdc19a47e70c4773d3c725d00625282"},"conditions":[{"condition_id":"bounded-claim","status":"pass","evidence":"The published meta-analysis makes a bounded recognition-and-response claim across the retained tests."},{"condition_id":"raw-content","status":"pass","evidence":"The official binary workbook downloaded as a real content artifact."},{"condition_id":"reproducible-baseline","status":"fail","evidence":"The preliminary record contains one workbook but no verified baseline code or complete reproducible analysis specification."},{"condition_id":"named-boundary","status":"pass","evidence":"The source's screened study set and control/manipulation distinctions identify a synthesis boundary."},{"condition_id":"independent-structure","status":"fail","evidence":"The queue requires independently assembled public evidence tables; this screen verified only one synthesis workbook."},{"condition_id":"meaningful-consequences","status":"fail","evidence":"No independent reconciliation source was established, so contrary reconciliation outcomes cannot be predeclared."},{"condition_id":"self-contained-interpretation","status":"fail","evidence":"Interpreting study-level coding without the underlying source tables would require unavailable study-specific judgment."}],"disposition":"rejected-pre-admission","reason":"A real synthesis file does not satisfy the independent-table and self-contained reconciliation requirements."},{"seed_id":"seed-home-range-calibration","pattern_id":"seed-pattern-calibration-condition-shift","primary_source":{"url":"https://doi.org/10.1111/2041-210X.13270","location":"Title and methods package: small-effective-sample-size home-range estimation with calibration data."},"official_data":{"url":"https://zenodo.org/records/4976491","artifact":"tapir.zip","checksum":"c472af69ad8ff806c24046ca514a99c3"},"conditions":[{"condition_id":"bounded-claim","status":"pass","evidence":"The paper makes a bounded methodological claim about overcoming small effective sample sizes in home-range estimation."},{"condition_id":"raw-content","status":"pass","evidence":"The downloaded package contains tapir tracking data and five calibration CSV files."},{"condition_id":"reproducible-baseline","status":"pass","evidence":"Package README identifies ctmm-format columns, calibrated variance, and uere.fit as the published baseline procedure."},{"condition_id":"named-boundary","status":"pass","evidence":"Small effective sample size and calibration error are explicit method boundaries in the source title and README."},{"condition_id":"independent-structure","status":"pass","evidence":"Five calibration datasets are separate from the tracked tapir dataset, permitting a held-calibration assessment."},{"condition_id":"meaningful-consequences","status":"pass","evidence":"A held-calibration check can distinguish support, attenuation, or contrary calibration sensitivity for the stated method claim."},{"condition_id":"self-contained-interpretation","status":"pass","evidence":"The README defines each data table and says the final analysis can be reproduced from the provided tapir data and calibration result."}],"disposition":"pre-admitted-seed","reason":"All seven preliminary conditions have direct primary or official-package evidence. This admits only a seed for source-and-fragility audit; the original method may still make a nontrivial candidate impossible."}],"summary":{"records_screened":5,"pre_admitted_count":1,"rejected_count":4,"quality_measure_state":"One complete pre-admitted seed exists; construction reliability is not scored until five to eight complete seeds undergo full audit."},"prohibited_next_step":"Do not send a rejection or pre-admitted seed to System 2, and do not call a seed a target before full audit and the three-target gates.","next_permitted_action":"Run one source-and-fragility audit only for seed-home-range-calibration; search the next contrasting design pattern only for missing complete seeds."}
